{"T_world_from_camera":{"representation":"column_major_4x4_f32","values":[1,0,0,0,0,1,0,0,0,0,1,0,0,0,0,1]},"capture_session_id":"0f936474-e29d-415d-9691-b52faed6227b","coordinate_space_id":"893addc6-b4b6-4cb4-8da2-67c64765ffa5","depth":{"confidence_byte_count":1056,"confidence_relative_path":"evidence/depth/bf05816a-4d99-4bd4-ad0f-b807a22f6f82.confidencebin","confidence_sha256":"49728a5e5681268804e0b7863808cb56ec7fe5ff74fb8995f782348e9102a682","depth_byte_count":4128,"depth_relative_path":"evidence/depth/bf05816a-4d99-4bd4-ad0f-b807a22f6f82.depthbin","depth_sha256":"6efd6d18c370919988aec084582edfb8b0ed6d318f00f36b8a3125f65fdd9b3c","kind":"smoothed_scene_depth"},"depth_status":"captured_smoothed_scene_depth","exif_allowlisted":{},"frame_id":"bf05816a-4d99-4bd4-ad0f-b807a22f6f82","image_height":1,"image_width":1,"intrinsics":{"representation":"column_major_3x3_f32","values":[1,0,0,0,1,0,0,0,1]},"pixel_byte_count":60,"pixel_format_fourcc":875704422,"pixel_relative_path":"evidence/frames/bf05816a-4d99-4bd4-ad0f-b807a22f6f82.pixelbin","pixel_sha256":"b54ebe26be764ead303b5e4f7566bafdab3f1cf9dcee12ae9440552b36628139","session_timestamp_s":3}