{"T_world_from_camera":{"representation":"column_major_4x4_f32","values":[1,0,0,0,0,1,0,0,0,0,1,0,0,0,0,1]},"capture_session_id":"0f936474-e29d-415d-9691-b52faed6227b","coordinate_space_id":"893addc6-b4b6-4cb4-8da2-67c64765ffa5","depth_status":"unavailable","exif_allowlisted":{},"frame_id":"198d102f-8c24-416f-bbf4-e6f50a68943d","image_height":1,"image_width":1,"intrinsics":{"representation":"column_major_3x3_f32","values":[1,0,0,0,1,0,0,0,1]},"pixel_byte_count":60,"pixel_format_fourcc":875704422,"pixel_relative_path":"evidence/frames/198d102f-8c24-416f-bbf4-e6f50a68943d.pixelbin","pixel_sha256":"b54ebe26be764ead303b5e4f7566bafdab3f1cf9dcee12ae9440552b36628139","session_timestamp_s":9}